X,y
Coyote in the morning. #wildlife #coyote #photography #Malibu https://t.co/Sqg4yh3LDD,1.0
"@ai6yrham We live in an area with coyotes and foxes, you just keep your pets indoors and enjoy the wildlife sightings!!",0.0
there’s a baby coyote sleeping outside the office 🥺🥺   Y’all think I can make it my pet?,1.0
look at this big ass coyote Rosie &amp; I saw this morning 😳 https://t.co/2g5qtqvHnb,1.0
@zark_101 @FeistyPK2 I hope not otherwise I’m throwing  that doll to the coyotes😂😂 he’s actually making Chuckie the doll look good😂,0.0
Filming outside and the coyotes are howling and what not.,1.0
@Carrion_Coyote Yeah. Unfulfilled is the word,0.0
#ORIGINSTORIES: @CoyoteNCrowRPG with @ConnorAlexander https://t.co/2owHCuK67b   #ATribeCalledGeek #Indigenerdity,0.0
@Nameless_Coyote I loved Mario Tennis on the N64. Luigi had one of the funniest tournament trophy celebrations.,0.0
"A coyote that was crossing the street in San Marcos on Tuesday was hit by a car so hard that it became lodged in the front grill -- yet, believe it or not, the animal escaped without injuries. #DSC1015KGB #LoveYourShowDSC https://t.co/R7HRdsVCYh",1.0
My ass almost hit a coyote driving in Glendora wtf 😂,1.0
@savg_coyote Open your DM or HMU. Lets work :).,0.0
It's almost time for #CoyoteCreekChristmas. See the photos - https://t.co/w5gP6O6muU https://t.co/cSmG5AjvFY,0.0
"@Archergal I’ve tried that, but I’m not the howler I used tho be. I used to be able to get every coyote in the area going.",0.0
Agencies upset over coyote trapping https://t.co/Lh14Tp8Qdn,0.0
"A Phoenix couple caught their cat chasing away a coyote from their home early in the morning and it was all captured on their security camera. ""Lucky, spunky cat.""  https://t.co/8bnfBWc677",1.0
"Despite windy conditions, Hornet golfer Chelsey Gutirrez places first overall individually and the Hornets placed sixth overall in a home tournament at Coyote Hills Golf Course Monday  ✏️ Jared Chavez 📸 Blare Parke https://t.co/pH0ne8o3Xx",0.0
@luna__coyote You got this good luck!!,0.0
@HonkIfUrHoary It's difficult to tell. I'm tempted to say not a coyote.,0.0
we’re just wile e coyote off the cliff and we haven’t looked down yet to accept what we’ve done https://t.co/0OPKFLNMjq,0.0
The rotten egg smell is gone. The coyotes are gone 🙏🏽,0.0
Movie of the Week Recommendation: Coyote Creek Christmas https://t.co/DyFbMj4Ar8,0.0
Jumpstart’s Read for Record Day - Kindergarten enjoyed having Superintendent Martinez as our guest reader! She came wearing her mismatch for our school sprint day! https://t.co/pZR5NCV7mw,0.0
"Cal State LA took the first match on Friday, but again fell to the conference leading Coyotes in San Bernardino. https://t.co/km9AiUj1Br",0.0
Quite the night — Noah’s #ADHSHL varsity goaltending debut @greatparkice on Friday was a demonstration of a Capo Coyotes team that refused to quit. #hockey #goalie #capocoyotes https://t.co/0a4uaB8w0B,0.0
@rich_roberts @HaSeongsRim Have we ruled out the possibility that a coyote stole it?,1.0
@XFabulash14X He’s adorable when he does that and also he’s teasing his coyote too. That lil flirt. ;),0.0
@ActiveNorCal @Travel4Wildlife There is a night video of a coyote and badger traveling together. Interesting.,1.0
"@JoeRunsThis I’ve had tea recently, but no coffee. Maybe when I was on mushrooms few months back I thought I had coffee with the “coyote” that turned out to be an orange Home Depot bucket 😂",0.0
@sdhumane Update on the coyote?,0.0
@ai6yrham Hope they are ready for their rat population to expload! I would take a coyote over a bunch of rats any day!,0.0
@jimbeam70648550 @Philzfacts @sfarieri Yes. I never suggested it was a bad deal for Arizona. The coyotes are rebuilding / I love what they’ve done.   That’s not the point. The point is that Philly had to give up a 2 to get rid of a defenseman who once had a 60 point season and will prob get 50 this season,0.0
@danielleradford This makes Ripley sound like a more successful Wile E Coyote,0.0
Attention Coyote CCP Elective students! The Achieve 3000 Fall Reading Challenge begins soon. https://t.co/vtCU2hKYEK,0.0
Breakfast of champions #wildlife #coyote #NaturePhotography https://t.co/Hkux6gHUIY,0.0
@Dheepa97 Ok maybe we’ll spot some coyotes,0.0
"""Hunting is not a sport. In a sport, both sides should know they're in the game.""  - Paul Rodriguez  Stay safe. Be strong. Most of all be kind. Have a peaceful weekend friends. 📷 Eastern #coyote siblings enjoying a family cuddle and grooming moment. #onpoli #biodiversity #love https://t.co/m8Rv2gGcHI",0.0
"G goes to daycare twice a week to get her energy out. I found out today that my part-time coyote, full-time cutie loves the daycare camera 🤪 https://t.co/LgYpQbAVxv",0.0
"They’re often starting from closer locales having been given refuge &amp; jobs in Mexico for months/a year! There’s International Airports in Mexico City &amp; Panama City. These Migrants might require “funding” but most are dressed, w/cell phones &amp; good shoes except the coyotes’ kids. https://t.co/QXZHuGwPZJ",0.0
@PHNX_Coyotes Melker Karlsson of SJ is the Melk Man. We’re not stealing someone else’s nickname.,0.0
"Yes, and for coyotes.   These animals are as part of America as anything.   https://t.co/W1lk3ZJjvY",0.0
@SketchCoyote intended for skyotes to be majestic... Like hawk wings and coyote ... Then I come along and make them derpy as hell and make them official pigeon hybrids https://t.co/pc5ms5DQDg,0.0
@LO_FLAPanthers @Mandoman12 @CarlPavlockFFH And because Gudas was only defending himself- it is why the Coyote player got the instigator call.,0.0
"Hey Coyotes! The CHS girls water polo team will be having a fundraiser at The Stand this Saturday, 11/6 from 11 am- 9 pm, and another Fundraiser at Uba Tuba next week, 11/10 from 3 pm- 6 pm. Show your support and grab a bite to eat. Make sure to mention #CHSGWP. #lvusd https://t.co/4DfVMbyBUV",0.0
@brody_coyote @BobbyBoyRecords Let’s goooo bro!!!,0.0
people living in fox hills complaining about coyotes…y’all thought it was named fox hills just for fun?,1.0
Love walking home when three coyotes are joggin down the street lookin for fun,1.0
Wonder what it would be like to problem-solve like a coyote? #WhatIf You Learn Like a Coyote?  https://t.co/GVgagGzxMQ,0.0
"@LAmeekly Bánh mì, mountains, enclaves within enclaves, parks, pubs, buses, coyotes, swap meets, theaters, plastic food displays, pumas, architecture, ""ethnic"" malls, museums, folk art, pupusas, bears, revival cinemas, islands...basically everything except the sunshine, slebs, and cars.",0.0
"OCTOBER DAYE X TRAIL OF LIGHTNING  As apocalypse engulfs two worlds, Latinx atheist Serena discovers she's a coyote shapeshifter when the fae kidnap her BFF. But to free them both, Serena must risk destroying Faerie and Earth.  #DVPit #A #P #F #UF   #OWN #DIS #Atheism",0.0
"@ForcedAdversity Nope. One's a coyote and the other's a wolf. Wile E. Coyote and Ralph Wolf, to be specific.",0.0
"My guy!  Great team leaders for @CalabasasFtball.  They played well and fought hard Friday night.  Team Captains, all juniors: @kingmill_er, @SeanStepenosky, @ethanclemonsEC, @CarterQB_4.  Go Coyotes!  @EliavAppelbaum @CaryHarris07 @latsondheimer https://t.co/zLJMC7OZoH",0.0
🎶 Hello Coyotes what a wonderful day!   I’m here in your class with something to say.  Red envelope week was huge success!  You helped our programs be their very best.  So keep up the great work in every way.   This is Hippo saying peace and have a good day! 🎶 https://t.co/SZFObHLVEE,0.0
@kirst_alyssa Move the coyotes to Quebec where they will do better,0.0
Before the coyote sighting.  #😳 https://t.co/5m2HgvidbT,1.0
This is right up there with Aaron Brooks' backwards pass or Pete Carroll not handing the rock to Marshawn Lynch with the Super Bowl on the line. It's like a Roadrunner and Coyote cartoon come to life. @deanriehm @BDaddyLiberator @MeeorxMox https://t.co/WH5BF2diyI,0.0
"What's your favorite predator? Bolsa Chica is home to some major predators like coyotes, raptors or birds of prey (hawks, owls, falcons, etc.), rattlesnakes, and even sharks!  photos: Mike Hodgson, Roy Holden, Steve Smith, Babs Levitan, Beverley Hansen, Ramon Medina https://t.co/cGBobNy5co",0.0
"@LesserIsMorer @beard_sports @walsha So, it's not like that changes the ""parity"" that's currently in the league.  No cap would allow players to make way more money, and smaller market teams would get way more revenue.  We could finally stop talking about where the GD Coyotes are gonna play every summer.",0.0
"@HistoryInbooks @MentalHealthBo5 I’m so grateful for the Chemeheuvi @GoLakeHavasu Water = life = wealth. Ocean Woman created the earth. Wolf, Coyote &amp; Mountain Lion led the way. We’re all connected. #History #mentalhealth #writerslift https://t.co/MG4uUyHArS https://t.co/MRg4CRonAR",0.0
@ABC7 Cute how the coyote acted playful like a dog &amp; wagged it’s tail. I’ve never seen a coyote do that.,1.0
@iFooYa Sounds like coyotes…or that’s what I would want to believe.,1.0
@Chicane_Coyote Same actually when I saw him walk by me. LOL,0.0
@mighty_mia Omg she looks part Coyote 😎 Beautiful…… she will go when she has to or try taking her to your front yard on a leash?  Good Luck! 🐶❤️,0.0
"@Rainmaker1973 One morning last year, when I got up before dawn to see comet NEOWISE from Pasadena,CA, I was amazed to see coyotes in front of and behind a raccoon as all three made their way down the sidewalk, single file, to perform some mischief.",1.0
"Hey @OrangeVistaFB , we have some future Coyote football players in the making. #FalconsUnitedInExcellence https://t.co/S2VKMfkNt7",0.0
@awfulsexworker we gonna have to get them those ugly coyote protective vests,0.0
"@EvilViergacht I wish I had the time to follow every development. At the very least, this is seriously bad optics for Montana.  Closer to home, they're shooting coyotes with no bag limit. Even juveniles.",0.0
#CountdownToChristmas is one of our favorite times of the year &amp; this movie is one we're looking forward to the most. #CoyoteCreekChristmas https://t.co/w5gP6O6muU https://t.co/lRJHqmf6zU,0.0
That was either a little husky or coyote on the side of the road 😕,1.0
@Chicane_Coyote No to both...,0.0
&lt;glyph of barfing coyote&gt; https://t.co/jTy4dC545g,0.0
Just a reminder that Red Ribbon Spirit Days start Monday! https://t.co/MCGBGOu1J9,0.0
@saylahachey Mine doesn't like it when the coyote comes around. Not at all,0.0
Hey coyotes! Here is our bell schedule for tomorrow (10/29/21) HOMECOMING DAY! Please screen shot this so you know our bell schedule for the day. #bellschedule https://t.co/dSDGUH6IBq,0.0
Oh my god. There was just a traffic jam on California Blvd in front of our house because a peacock was chasing a coyote down the middle of the street. I swear I’m not making this up!,1.0
"Coyotes Football Playoff Tickets on sale now, online only.    This Friday, November 5, 2021 at Indian Springs  High School vs Verbum Dei.  7:00pm Kickoff. GO COYOTES! https://t.co/fTKqtY9ES0",0.0
Coyote and bobcat caught on camera https://t.co/FcLZZG6JQX #trending,1.0
@kilokamilo @_jpow @SiriusToken @DavidDo74603299 Varmint control. Use it for coyote and boar.,0.0
Coyote Rescued After Getting Lodged in Front Grill of Car https://t.co/HG4ZO5SPQj,1.0
"Dude, there’s all these coyotes howling outside right now. It’s 6:30?!!!",1.0
@ai6yrham It says they adopted the coyote and it learned to play with the cat. But would like to hear an update few years later.,0.0
@ravenscimaven The only Souther California pizza I’ve really really liked was Little Coyote in Long Beach. Lots of meh pizza here but the Mexican food is 🔥,0.0
"@ai6yrham Because … wanton disregard for consequences and how their decisions (may) impact any of our natural resources, let alone so-called “varmints” like coyotes.",0.0
"This little guy is 8 months old and was rescued from a dingbat in the high desert who got tired of having a cat and kicked him out to be a coyote snack.  Fully vaxxed, neutered and in need of an awesome indoor home!  He's in Moorpark.  Dog friendly &amp; social.  DM me! https://t.co/UCiRTDpBKc",0.0
"FINAL: Westlake 39, Calabasas 12; Warriors finish regular season at 5-5 overall and 1-2 in Marmonte League; Coyotes finish 3-7, 0-3 @_WHSAthletics_ https://t.co/gWQDVa4qxM",0.0
"@jabbafanclub @Nextdoor @bestofnextdoor And then you always see the follow up a few days later where they're all ""aww my poor baby got eaten by coyotes"" like oh no if only there was something you could've done to make that never happen, such as uhh not leaving your pet outside to be eaten by coyotes #weird",1.0
"Hey Coyotes! IT'S HOMECOMING WEEK, which means its also #calabasashsspiritweek here in Coyote Nation! There is a twin day, a costume party and much more. Happy Homecoming week and Happy Halloween Coyotes! #coyotepride #calabasashomecoming #calabasashoco #lvusd https://t.co/UtMWltCAeP",0.0
From Great Pyrenees Customer  Bren and Jeff C  Maggie is a big girl. Scared her first coyote away at 4 months. We praised her very much. We were right there with her with our chihuahuas https://t.co/PKK7ijKyog,1.0
The coyotes in my neighborhood refuse to abide by our traffic laws. They should be fined and sent to mandatory traffic school.,1.0
"@Doc_Coyote Oh, I have been there https://t.co/uZOwjl0eqY",0.0
@brody_coyote @BobbyBoyRecords @defjam Thank you Brody,0.0
"@dr_earthquake This may be even more specific than that. Only in Southern California? LA County? The San Gabriel Valley? The specific combination of busy street traffic, wild peacocks and coyotes?",1.0
"A Phoenix couple caught their cat chasing away a coyote from their home early in the morning and it was all captured on their security camera. ""Lucky, spunky cat.""  https://t.co/9CgTd7O8rG",1.0
@Doc_Coyote I SAW AND HAVE FRANK AND SONS AMBITIONS,0.0
"In September, there were 4 reports of coyote interactions in San Marino. 3 of these were Level 1 (hearing or seeing coyotes) and 1 report was Level 2 (coyotes entering the yard with or without pets present).   Report coyote sightings:  📞(626) 278-8039 📧coyotes@sgvcog.org. https://t.co/CT0fQRxu7n",1.0
Thank you @ReporterDawn for great reporting and @TOAcornNews for putting it on the front page!  Tragic.  Coyotes are highly intelligent and just trying to survive.  Keep small pets indoors! Thanks also to @COSFoundation for your advocacy on this issue!👏👏 https://t.co/PMMhJzFy5E,1.0
I don’t think coyotes or dingos are mean. They are small and cute.,1.0
"@HeartlandDreamr I should add I’m always alert and looking around, my bear bell is jingling, and I clap my poles every so often or if I feel vulnerable. So I don’t take the warnings lightly. Now if there were coyotes I’d be more frightened as they stalk and chase.",0.0
"@ai6yrham Coyotes will breed to fill the void, so pointless.",0.0
Testing out the @furality legends emissions and audio link related features on the furality shader. Here's my goofy dancing with coyote Orin. xP  🎵: Rogue - Move me  #Furality #FuralityLegends https://t.co/vcmfhKL5oU,0.0
Weekly Howl Volume 1.10 - 📢 Check out what's happening at San Altos and see who this week's Coyote Fist Bump winner is! https://t.co/B2HpvZOmHu https://t.co/xn4pHTehfh,0.0
@ai6yrham It depends. I have a friend who lives in Sherman Oaks and every time they walk their dog they see coyotes. And I don’t mean from a distance. This is a heavily developed area and those things are aggressive.,1.0
Kinder Coyotes exploring and sharing strategies for solving problems! How do you go about solving a problem? #cvesrocks #canyonviewelementary #powayunified https://t.co/nHsaq2y7Po,0.0
@pattonoswalt This is still one of the funniest things I ever read   https://t.co/Ik8irHyA8X,0.0
@myBurbankNEWS Saturday I saw a coyote comfortably snacking on a squirrel around Pass and Verdugo on a front lawn.,1.0
"Real learning happens when students are able to apply their knowledge, think critically and engage in conversation. Increased student “talk” makes a huge difference! Go Coyotes! #CVESRocks #CanyonViewElementary #PowayUnified https://t.co/jznvwQoYUq",0.0
@Coyote_Prettyy That man gets by on luck alone,0.0
@Jess_inthewild Did a coyote write this,0.0
"#ThousandOaks, Enjoy Living in a Community Surrounded by Open Space Shared w/#Wildlife?  Plz join me in signing a petition urging the North Point HOA to stop trapping &amp; killing #coyotes:   https://t.co/qXRKGVdxQd  #ConejoValley #nature #outdoors #animals #hiking https://t.co/x4ZuM4hyPC",0.0
"It was an #intimate garden, a place for quaking aspen and mountain quail, their plumes electric with angst, anticipation. What lie in wait there: coyotes, children on a field trip, a wayward fox on the prowl? #vss365 #prompt #nature",1.0
It’s gettin’ coyote ugly up in here no tyruhhh,0.0
"@zachklein @TorranceCA: How about doing beneficial shit like this? But no, you’d rather cut down our trees and kill our coyotes.",0.0
Check out this new photograph that I uploaded to https://t.co/00rjKMNLC8! https://t.co/Va9JMw5r7J,0.0
Swear 2 God I just saw a baby coyote at Vermont and Melrose,1.0
"Heads up folks, probably won't be that active during the Ducks game seeing as I will be at the Flyers Coyotes game tonight!",0.0
"OCTOBER DAYE X TRAIL OF LIGHTNING  As apocalypse engulfs two worlds, Latinx atheist Serena discovers she's a coyote shapeshifter when the fae kidnap her BFF. But to free them both, Serena must risk destroying Faerie and Earth.  #DVPit #A #P #F #UF   OWN DIS Atheism",0.0
i'm gonna pull for Thoma as soon as i get home  if i get Hu Tao i will lay in the orange grove out back and wait for the coyotes to come eat me,0.0
"If Wile E. Coyote could afford to buy all those roller coasters and TNT from Acme, why didn't he just go to KFC and buy a chicken?",0.0
"@jodilasky2 @DonaldJTrumpJr And when you say separated families, are you speaking of how Trump DID NOT allow minors with adults who weren't their parents? You know, like coyotes &amp; drug cartel? Wake TF up!",0.0
Now Playing:  Coyote by Joni Mitchell on https://t.co/NX6Q0NVj7f https://t.co/e30CeEMeN3,0.0
"We apparently have a non “aroo” corgi. Sienna used to howl at sirens, but Tazzy hasn’t howled at all. I’ve taken to playing recordings of coyote howls to encourage her, but to no avail. https://t.co/p1sEb2oiQK",0.0
@Grinning_Coyote @Jamesrus42 I’m a native Californian too and I knew Sutter’s Mill but guessed 1840… 😂 been a LONG time since 4th grade!! I also remember building the missions!!,0.0
.@JanelParrish and @RyanPaevey get their flirtation on in @hallmarkchannel’s #CoyoteCreekChristmas.  https://t.co/P3Dg9ojiIr,0.0
"Woke up feeling great! Must be GAMEDAY!!!  Very proud of our FAMILY. Tonight will be a great challenge vs. the MVL champs, but going into our last game with a shot is all anyone can ask for. Blessed for the opportunity. Can’t wait for 7 PM  Let go Coyotes!!!",0.0
See this Instagram photo by @sc_coyotes https://t.co/8mQsVfUvJ2,0.0
I’m super confused which is the coyote? @SheaSerrano @SpursCoyote https://t.co/BuAtM7PNkb,0.0
@twistedleafs I don't understand how he can go on any platform and tell him what the Blackhawks did isn't as bad as what the Coyotes it Devils did,0.0
@ibookery @drkiki @padresj Right! Someone else made the Wile E. Coyote connection. It's a very odd decision.,0.0
@thechiccodes I assume it was the coyotes running around but I didn't see them eat the tomatoes off the vine. It could have been another wild animal.,1.0
"Just spoiling the conclusion here for you, the Arizona Coyotes will get punished by the NHL more harshly for illegally working out draft prospects than the Chicago Blackhawks will for allowing ongoing sexual harassment to happen.",0.0
i have to leave LA because no one told me coyotes start yelling at 6:30,1.0
"Feeding wildlife may be fun, but the effects are not! Leftover food scraps attract coyotes to our homes, allowing them to become more comfortable around humans. Remember this Halloween that treats are for kids, NOT wildlife! #coyote #sangabrielvalley #neighborhoodcoyoteprogram https://t.co/9ugReGUuaV",0.0
"@ChaseFreo the better to eat coyotes with, my dear.",0.0
Coyote attack on chicken caught on cctv https://t.co/L8NgVFIU7Q via @YouTube,0.0
tapped in wit Wes for when I touch down cause niggas said it won’t none of the long distance ranges round the way like how Angeles one is out Sylmar niggas hunting coyotes and using his land instead a lil pass Augusta still able to spin back into Atlanta no problem.,0.0
"Kings suck as always but at least we aren’t the Blackhawks or Coyotes right now, two franchises in utter turmoil. 🤣🤦🏻‍♂️",0.0
"Lady Coyotes Tennis at League prelims and finals today and Thursday, hosted at Jurupa Valley.  Good Luck Coyotes!! @ Jurupa Valley, California https://t.co/JhSrxrlQsJ",0.0
"What a beautiful weekend at @carlsbadshops.  We work hard, we work safe, and we have fun. Happy Halloween from your friends at the Carlsbad Village Faire!  📸 1️⃣ @claracarlsbad 2️⃣ @coyote_carlsbad 3️⃣ @gonzo.ramen 4️⃣ @thecompasscarlsbad https://t.co/RaDn52lp4V https://t.co/vDo3XS4YsR",0.0
Had a short but nice reset at Big Bear for a few days. I also had to call my husband to pick us up down the street because a big coyote was running down the street as I was walking my reactive pup. Did I run into someone’s yard to wait? Sure did. It’s all rentals &amp; it was dusk,1.0
Please visit our website https://t.co/a5OWf3PsSb for an update from Superintendent Martinez.,0.0
. @jackieemma91: I’ve had the worst drive Coyote: bet!  *Coyote runs across the highway*,1.0
"For those of you in San Diego without the Nextdoor app, your neighbors think they may have seen a coyote.",1.0
Video: Chihuahua Carried Off by Coyote in Broad Daylight as Owners Scream But Survives Backyard Attack via @WestJournalism https://t.co/t3GsTRg6Vn,0.0
"@Amy1112Yuzu We get wild animals go into trash cans when people have trash out a day before the collection day…bears, 🦝, coyotes….",1.0
Love to hear a pack of coyotes go absolutely buck wild like 2 minutes before we were gonna take the dog for a walk.,1.0
"@nevslin We have a few that walk a path on the other side of my street every night.  Once evening a few weeks ago, I heard barking for a long time - went out and it was one of those coyotes sitting on a rock just yapping for no apparent reason.  They actually are quite pretty.",1.0
@savg_coyote @boltupnick Ratio,0.0
@yotestradecen @PHNX_Coyotes Agree to disagree with you on this one.,0.0
"@catneedsanap The 3 other dogs have stayed here before. 2 are escape artists: 1 is half coyote, the other can chew through anything. 3rd one is the alpha male, but she's a female",0.0
"Looks like TNT has a west-coast NHL game every Wednesday after wrasslin (AEW). That's a pretty cool lead in - miles better than anything that was going on before NBCSN had games on. Unfortunately, in two weeks they're featuring a Coyotes game 😬",0.0
@Arclight_Snep @manedwolfy @Furytheoddity @DUNE_COYOTE Mmm coulda been more toppings going on but next time right?,0.0
Be safe out there coyotes 🎃 !  #CoyoteRadio FG https://t.co/6wBvDE8yqs,0.0
@Doc_Coyote Makes sense to me,0.0
"To the guy that I saw in the Selanne Mighty Ducks jersey at the Flyers Coyotes game, sup?!?",0.0
"My sweet little nugget got attacked by a pack of coyotes tonight and although he’s has minimal puncture wounds he wasn’t able to use his back legs. Even a share would help, we just want our little man to be home and okay.  https://t.co/04gXMh34aC https://t.co/cDaCpVrzDb",1.0
the los feliz coyotes are OUT tonight,1.0
@Doc_Coyote It’s the Best Ending for Strange tbh. I love it. I love him. Can we do a Guardians of the Multiverse TTRP thing one day pleeeaaase I can help but I mostly just want to play him so bad,0.0
San Diego Humane Society caring for coyote rescued from car bumper in San Marcos https://t.co/l1rE381UNZ,1.0
"I am personally super unimpressed when a girl calls herself a goddess.  That's what other people call you.  Calling yourself that is cartoonishly self absorbed.   Like Wile E Coyote having a business card that says ""genius"" on it. https://t.co/eS29gzAmbI",0.0
@jenannrodrigues Coyotes here jump over fences. Can’t let your cat out or leave your dog in the backyard here,1.0
"@ogiegoldthorpe @DomRichard1988 @alfred_jens @ldl716 Well he's signing with the Arizona Coyotes July 1, 2024 so they better trade him sooner. #Yotes already shedding contracts &amp; tanking to stock the future with some very high draft picks to lure him. Matthews is going to save hockey in the desert &amp; lead them to a Cup, not the Leafs",0.0
"My biggest question in life is,,,, how did the coyote survive all those accidents!?? 👀🧐😂🤣 #loonytoons  #oldschoolcartoons https://t.co/W8PsL9u5Cg",0.0
@Dryadula No wolves in these parts. Coyotes and foxes and bears and mountain lions sometimes. But no wolves.,0.0
@AndyRichter Or a coyote yelping 3 miles from the house,1.0
A coyote ran across out path while we were out exploring our neighborhood and I'd like to think that's a positive omen of some kind,1.0
They start 7-0 they’ve played the bruins penguins islanders lightning avalanche flyers and the coyotes. 6 of those teams are playoff contenders and the only team that put up a fight against the panthers was the penguins,0.0
"Bonus Mini Halloween Party pix, provided by @fablepaint ! Featuring @JacobDavison_ as Jason, @TheQueenCryptid as her true werewolf self, @KilotheMonster as The Lizard, @Doc_Coyote as a snazzy necromancer, and me as Strange Supreme lolol https://t.co/IP9TzH1ha7",0.0
