X,y
"So sad. Greedy developers destroying wild areas. No need to develop further into the canyons and foothills. Greedy developers destroying deer, mountain lion, and coyote habitat.  There is plenty of developable land in the valleys and urban areas. 😡😢🐺🦌🦅🦉 #optoutside #nature https://t.co/qXJT0MoEy6",1.0
"okay, coyote-badger friendships are a thing! https://t.co/1G4EjZ0zu1",0.0
"@JessieKenny8 In SoCal, there’s a very good chance that a cat left outdoors will be attacked by coyotes.  My 80 lb dog was attacked twice in one month. We keep him inside at night now.",1.0
"@HeartlandDreamr So true Rachel. There is a lot of human and wildlife conflict, worldwide. In Vancouver there has been a lot of coyote conflict, with the coyotes stalking, chasing and attacking people, even young toddlers.",0.0
Just saw a post about a lost coyote/husky in the neighborhood who looked suspiciously like our summer foster dog. Was I trying to train a coyote dog? Was that why it was so damn hard? Omg people need to spay/neuter their pets. 😫,1.0
"@FlannelJedi @Doc_Coyote The fact there's reviews around makes me think a shipment came through, but additional shipments are probably locked in supply chain hell",0.0
@CoyoteRadioCSU Where was that when *I* was a Coyote Radio DJ??,0.0
@AndyCole1984 Sorry just feeding the coyotes.,0.0
@Nameless_Coyote My best suggestion is in the options menu to turn the music off because you’ll hear more clearly a line Luigi says that you might miss with the music on.,0.0
"@CrytzerFry Fortunately, many wild animals are (as you know better than most) amazingly adaptable &amp; resilient — I love that coyotes find a way despite the despicable behavior of despicable humans. So happy for you &amp; Tripawd! ❤️",0.0
@osgood9 My pleasure. I went to both locales this past month. Was at the Greek on Saturday. Coyotes were out in force.,0.0
Badass cat.  Cat Chases Coyote Away From Family Home in Daring Video https://t.co/145OSh9jHW via @Yahoo,1.0
@GolfBurner As IU grad pains me to say Purdue Courses along with Coyote Crossing is hard to beat for value golf trip. Btw just played Lawsonia &amp; SV a few weeks ago outstanding.,0.0
"@smc429 @ThatEricAlper I was a Highwoman And a mother from my youth For my children, I did what I had to do My family left Honduras when they killed the Sandinistas We followed a coyote through the dust of Mexico Every one of them except for me survived And I am still alive",0.0
You might as well eat at cafe Coyote and call it the best Mexican food experience ever 😂😂😂,0.0
Notes from the Field: Dr. Michelle Lute on the Latest Science About Coyote Diets and Behavior https://t.co/rJTTnfL72i via @ProjectCoyote,0.0
@VDLHSRavens! Want to learn how to be a @csusb coyote? Join us for our @calstate application workshop tonight! https://t.co/YmNDxXmNqH,0.0
"Kento was like the coyote in native American literature- the trickster who shows up out of nowhere, there to remind us not to take our self too seriously. Which makes sense coming from a dude who learned how to catch salmon from his own talking shit.  #markwestwriter https://t.co/VDbshK0B0O",0.0
@DissidentSoaps @ProdigalParable This just raised the price of coyotes.,0.0
"I moved into an area with lots of coyotes. Hadn’t seen one until last week, a massive one in the nearby park where I walk the dogs. Today, saw one on my driveway while I was working out in garage. Scary but so fascinating. I love living in a city that I get to share with wildlife",1.0
🕯I’m manifesting a Coyote Ugly in LA🕯 🕯put me to work🕯,0.0
"@tagaq Saw a group of about five coyotes today walking down the street, definitely hanging out.",1.0
@David954FLA Hopefully 6-0 after the coyotes tomorrow,0.0
#SongDogSunday  Happy Halloween 🎃  Awareness and understanding can save a coyote's life. Respecting their natural instincts and wildness helps establish safe and healthy boundaries. This means never providing those harmful handouts for a photo op or entertainment. Thank you! https://t.co/rHXuWCGWrI,0.0
"@HeartlandDreamr Well, wouldn’t say I’m brave. For example, when the salmon were spawning I never went near the spawning creeks in early morning or evening. Nor do I walk in places when it’s quiet. And for some reason the coyotes around here can be aggressive towards humans. Others can run away.",1.0
"@DunkaPeacecraft The Dems have been in power for a year, they've done nothing with it and thus have nothing to campaign on so they're forced to pull stunts like this that are sure to blow up in their face Wile E Coyote style.",0.0
@LAKings @GEICO I’m in pain as a kings fan but I remain loyal. I will never stop supporting my kings. Still can’t wait to cu guys play the coyotes in person on Nov. 21st. #GoKingsGo,0.0
"@xeni When the coyotes thrive, all the other animals and plants do, too",1.0
how do you say coyote?,0.0
"@teejeejeej I couldn't get past the first few episodes. It felt like a Billions clone. But now that Billions is essentially Roadrunner vs Wile E Coyote, I need to go back and try Succession again.",0.0
Happy Halloween Coyotes!!! Have fun and be safe! See you tomorrow! 🦊🧡🎃👻 https://t.co/eyXDvQi4Eg,0.0
"#ThousandOaks HOA Trapped &amp; Killed #Coyotes, &amp; Lied to Residents About It  @CaliforniaDFW's ""Keep Me Wild"" website (https://t.co/XDwpDDyDiH) has more effective, &amp; humane, suggestions for keeping coyotes from coming into residential neighborhoods  https://t.co/MLCLzVlSVB #wildlife",1.0
"@IamKingFluffy @LAKings I'm gonna make a bold prediction. Team # 32, Arizona Coyotes, will finish the season with a better record than the Kings.  You heard it here first!",0.0
"Heads-up neighborhood coyotes, I backed OAK-D-Lite and Mini Pupper: Open-Source,ROS Robot Dog Kit by MangDang on @Kickstarter https://t.co/VrfY7t8pfH",0.0
"The only positive thing about my #Nextdoor neighborhood has been updates on this black dog and coyote who have been living together in a public park. Mixed feelings about the dog being 'rescued.' I know it is for best but.... friendship, man.... friendship. https://t.co/U5kOSyxzv9",1.0
"@ai6yrham I thought ""Urban coyotes"" was another word for #TrashPandas 😂🦝",0.0
Aaaannnnddd The Lady Coyotes Win....11-7 over La Quinta today in the CIF Wildcard Round.  Tomorrow The Ladies travel to San Dimas for their match at 2pm @ Indian Springs High School https://t.co/PGKfoaoAJP,0.0
@Hockey_Royalty The Coyotes are taking tanking to a new level with Jay Beagle as their #1 Center and icing one of the worst teams in recent NHL history. Hard for any of their couple of good players to fly like an eagle like this.,0.0
I just seen a coyote in broad daylight over here in PH 🤣,1.0
@Coyote_Arts He has to give her a good sniff before he started grooming her because last time she’d rolled in something and he was APPALLED https://t.co/tVIyUO5riP,0.0
@pom_pom_puri so probably one (1) coyote,0.0
@oxojesss @MiguelMvrtinez On god wasn’t the migra gonna take him for djing for the coyote ?,0.0
@aussiastronomer Accurate. Though one time there was that neat video of a coyote eating a squirrel.,0.0
Principal’s Pals - Today our students learned about Leadership Habit #1 - Be Proactive! https://t.co/tKixO3zURY,0.0
@Doc_Coyote It's messed up,0.0
Predictions for today: Kings &gt; Blues  Lightning &gt; Sabres  Capitals &gt; Senators Panthers &gt; Coyotes  Rangers &gt; Flames Hurricanes &gt; Maple Leafs Blue Jackets &gt; Stars   Season Record: 36-46,0.0
Video shows cat chase coyote away from home  Read it here: https://t.co/k7V2PnXdNQ https://t.co/BUMtFq78qM,0.0
Get a summary of the Arizona Coyotes vs. Philadelphia Flyers hockey game. https://t.co/daYI0UpIqi via @ESPN App https://t.co/aoWPoUtVGo,0.0
North Point HOA: Stop the North Pointe HOA from trapping and killing coyotes. - Sign the Petition! https://t.co/S7NOwdT5AQ via @Change,1.0
"On October 24, 2013, Dwight King scored his first career hat trick in a 7-4 win against the Coyotes. King posted career highs in 2013-14 with 15 goals and 30 points, scored 11 points in 26 playoff games, and won his second Stanley Cup ring with the @LAKings.  #LAKings #GoKingsGo https://t.co/PKbaQRSISM",0.0
"@mcheno blackhawks caught and find by nhl for covering up sexual abuses for the good team chemistry, coyotes find for illegal practices, and devils find for apparently breaking rules regarding caps on signings..",0.0
@Joe_Schmucc This is about to be you going back and forth with that coyote lol https://t.co/f4wepou7KR,0.0
Books: Peter Coyote’s “Tongue of a Crow” #poetry #books #reviews #PeterCoyote #SanFrancisco #RobertDuncan #BrendaHillman #PatrickDonnelly   https://t.co/ZpbWUoEmT9,0.0
"❕ 15 days ❕  Register today before it’s too late!   If you are a Fall 2021 Grad, use your MyCoyote Portal. If you are a past Grad, please use the link in your email to register   #CSUSB #Coyote #CSUSBGrad #Commencement https://t.co/Bg7fsaE4aH",0.0
How many coyotes do you see? https://t.co/prnp68zRev,0.0
I wish Ventura county had a Coyote Ugly style bar. I’d sign my ass up real quick,0.0
"@TotallyAllen Imagining a coyote loping along the sidewalk past the Beastie Boys' apartment next to that smooth, smooth asphalt.",0.0
"Someone should start a page for all the crazy shit that comes across the @Nextdoor app… I’ll go 1st.. “a pack of Coyotes, Human &amp; Dog all meet late at night” for $100 Alex : https://t.co/XF1DIsyhtg",0.0
"Janel Parrish is one of our favorite #CountdownToChristmas stars, so yes, we're looking forward to this #HallmarkChannel movie! https://t.co/w5gP6O6muU https://t.co/o6b9bwcZYr",0.0
"@teamyasumura I just saw my first coyote since moving here! 10’ away, turning left off Beverly Glen near Mulholland (me, the coyote was not turning, he was driving fast, right on my ass, and when I clocked him in the rear view he def had “fuck you” in his eyes.) OK seriously I saw a coyote.",1.0
I’m so sick of 180 year old fuckfaces preaching to me about coyotes!!  Omfg!!! Shuuuut upppppp,0.0
@streeeeep Coyote Ugly yesss,0.0
"@hallmarkchannel @hallmarkmovie for BC, Canada viewers we do get Coyote Creek Christmas tonight @ 8pm and two other times this weekend.  The Christmas Promise we get Nov 6 @ 6pm and one other time.  Check your schedules",0.0
PBIS Rewards Celebration for August and September Way to go Coyotes! https://t.co/eE9GkTicer,0.0
@lc_coyotes I had so much fun!  Our @lc_coyotes Kindergarten scholars are amazing listeners!!,0.0
Ran into a coyote on the morning walk and Winnie forgot she’s a fucking Pit Bull 😂,1.0
"@xianleonard Dome, helicopters, and coyotes.",0.0
@JBB_SD @spacey_coyote @10News @MayorToddGloria Well they could choose to get vaccinated and protect themselves and their fellow citizens.,0.0
Predictions for tomorrow: Kings &gt; Sabres  Hurricanes &gt; Coyotes  Canadiens &gt; Ducks Devils &gt; Blue Jackets Kraken &gt; Rangers   Season Record: 63-63,0.0
@Greenfairy001 Did they jump all over you for causing coyote panic since this is their land?  See that bs all over the Nextdoor app.  Sorry sweetie!,0.0
These fucking coyotes brooo😤,1.0
"@AinsleyInc Between the Hawks malfeasance and then Aliu who won't go away (pretty sure he is ultimately looking for some cash, but could be wrong here), &amp; the Coyotes who have taken tanking to a new depth; tough PR times for the NHL.",0.0
Pretty unexpected NHL power rankings from @peteblackburn this week...  Coyotes? Not where you'd expect. Neither are the Panthers.,0.0
Look out! Those Crafty Coyote Pups are at it again and this time they have made it all the way to Build-A-Bear Workshop! Create your very own Coyote Pup exclusively at the Build-A-Bear Workshop in the California Marketplace. https://t.co/rmukmxMANY,0.0
"Roadrunner contemplating various stages of road engagement (beep beep!) 😀No coyotes in sight, sadly. 🐾🐾 https://t.co/zehceW9WX6",0.0
"The CSUSB 2021 Festival de Calaveras will be hosted by the Robert and Frances Fullerton Museum of Art (RAFFMA) on Saturday, Nov. 6 from 11 am - 4 pm.   Coyote Radio will be in attendance with prizes, giveaways, and playing local bands!   @RAFFMAcsusb @CSUSBALFSS @ALFSSCSUSB https://t.co/HfBc7hYC05",0.0
bruh i was this close 🤏🏻 to hitting a coyote on my drive home just now,1.0
Oh no! I played this and my dogs went bonkers! We have a pack of coyotes in the canyon behind me. Pretty sure that’s what was howling. 🤣 https://t.co/KgegI8ZqAu,1.0
"@savg_coyote @GACPodcast17 That ain't sarcasm, that's just a random ass statement.",0.0
Weekly Howl Volume 1.11 - 📢 Check out what's happening at San Altos and see who this week's Coyote Fist Bump winner is! https://t.co/kLD7evnPCl https://t.co/5Rwmb4JSS1,0.0
"@100peaks options:  ""I like coyotes, I just don't want them to eat anything.""  ""Everyone I don't recognize is a drug dealer""",0.0
"First full day back in LA, and I've already seen a dead (or sleeping?) coyote on my block. How's your day going?",1.0
@barilleon The Desert stage where you team up with roadrunner against coyote and his series of escalatingly dangerous/ineffective traps would be *chefs kiss*,0.0
@asaprajy @TheRewatchables @BillSimmons @ChrisRyan77 I dunno. Michael Mann is the one director who consistently makes his movies worse when talking about them. At a screening in Oct he revealed the coyote scene in Collateral was produced and not an accident. COME ON dude! Everyone thought that was such a cool story. Now its gone.,0.0
#SanMarcosCoyoteRescue (1/2) This morning our Humane Officers and veterinary team rescued a coyote who had been hit by a car and was lodged inside the grill of the car. The coyote was rushed to San Diego Humane Society's Ramona Wildlife Center for care. https://t.co/2no87bbc53,1.0
@ring Its a shame ring is in the business of coyotes but any criminal action or men threatening to fight everyone including women at dog park gets taken down but you keep posting about coyotes. I post about mail thieves and threats but i get taken down,0.0
@GirlWhoBets And Hurricanes -1.5. Coyotes are bottom tier and Carolina is a wagon.,0.0
"@ArizonaCoyotes @j_chychrun7 Happy Halloween, Arizona Coyotes!",0.0
Westminster Sr91 W / Coyote Creek **Trfc Collision-Unkn Inj** https://t.co/wYgQrAqg7T,0.0
"Hmmm, to post or not to post coyote pictures? 🤔",0.0
@coyote_teeth Are you going to be lost in a virtual world now?,0.0
"yall who has the coyote footage? I found one video, is there anymore? cc @LIONPRlDE",0.0
I would fist fight a pack of coyotes for a pizza right now,0.0
"Our greatest teachers are not books, or even old professors like me. Our greatest teachers are the creatures with whom we share this glorious, terrifying, beautiful, and mysterious world. My column - My Coyote Teacher - from the Nov/Dec Unity Magazine.https://t.co/aannHxraLo",0.0
"Hey Coyotes! There is a virtual PFC meeting next Wednesday, November 10th at 9:00 am. You don't wanna miss it.  Click here for the Zoom link:  https://t.co/2t8f4T7c9W or go to our website. #coyotepride #CHSPFC https://t.co/HDtuuiKqou",0.0
@dee_coyote I am causing problems on purpose.,0.0
"@LettuceLove2 She stalked us one time, but didn’t get too close. There’s a large pack of 8 coyotes that continue to bait my dogs into chasing after them. So I switch up my time and go on different trails to avoid the confrontation.",1.0
"I talked with @RyanPaevey about his new movie #CoyoteCreekChristmas, which premieres tonight at 8pm ET on @hallmarkchannel #CountdownToChristmas. We talked about playing a dad and which movie he'd like to do a sequel for if he had the chance. @culturess https://t.co/kAnznin2H2",0.0
@huttser_coyote @JeschkeSqrl That SWALLOW 💦💦,0.0
@NedRyerson1957 Consolation prize - it's a distant second! Coyotes are only killing off 36.4% of their PK's lol.,0.0
@andrewjhumphrey haha - i actually really like that she wanted to bring her animals but the cabin is just not built for that and i'm worried the coyotes will eat her little friends on night 1,0.0
@LEARLOCKS Sweated the shit out of that. I’m playing coyotes opponents -1.5 all year bound to make money they are awful,0.0
D1 taking on Capistrano  Coyote.  Go Eagles 💛🦅💙 https://t.co/fLWXgcc2qJ,0.0
@TDProductions2 The coyotes will need it revamp their pricing structure.,0.0
@aussiastronomer Bears!  Coyote! Bobcat! Mountain Lion! Lost pet!,1.0
"@Doc_Coyote Oh man, possibly crowded but I wonder if they’d be doing something special for Halloween",0.0
"@DavePrattSports No, but I did hear from several Coyotes fans that we would be very happy with his play. They knew what they'd lost.",0.0
South LA E Los Coyotes Diagonal / Bellflower Blvd Ofr **Trfc Collision-1141 Enrt** https://t.co/6pomG9ykpu,0.0
@OnlineAlison Several comments later… “I feed the coyotes!”,1.0
@Chicane_Coyote Oh my gosh that look so good!!! ❤️,0.0
Never seen a coyote wandering around this late in the morning,1.0
"Me: screams, “omg look at the sun setting it’s so pretty!” BF: no I can’t look, I’m driving and there are wild animals like rabbits and coyotes. Me: the sun is still out there are no coyotes!!!! 13 seconds later BF: look! A coyote!!!!! Wtf?!? Why was it out in the day?!?",1.0
@MikeIsErnie Did they rescue the coyote?,0.0
"@EBRPD must sever ties with USDA Wildlife Services. These hired guns have already killed too many of our parks’ cottontails, ravens, skunks, gulls, foxes, raccoons, opossums, coyotes &amp; community cats! #EBRPD #animals #AnimalAbuse #wildlife https://t.co/wRFG9MZWd2",1.0
"This week, Ivey Ranch Coyotes visited the spooktaculur Boo Zoo library and spotted some monster book tear art made by our TK class! We even got to see Harry Potter’s Monster Book of Monsters! 📚📖🐈‍⬛🎃✨👻 @OsideUSD @TrishQuinene #CoyotesConnect #ReadingIsMagical #DestinationOside https://t.co/VCAbkuEemn",0.0
Predictions for tomorrow: Kings &gt; Jets Lightning &gt; Coyotes  Flames &gt; Penguins  Hurricanes &gt; Bruins  Blues &gt; Avalanche  Flyers &gt; Canucks  Sabres &gt; Ducks Kraken &gt; Wild  Sharks &gt; Canadiens   Season Record: 47-54,0.0
@PeterAPeel Waited at the El Coyote valet stand next to Mr. Schiavelli back in the 90s.,0.0
"Not a metaphor, a literal coyote brushed against my leg last night",1.0
Just Asking:  NHL-Where's the leadership from Commissioner Gary Bettman-Union Chief Donald Fehr  Anyone offended: ..Denied link Concussions-CTE-Players Suicides ..Delayed probe Evander Kane addiction ..NHL not investigate Blackhawks sex assault case ..No intervention Coyotes mess,0.0
Predictions for tomorrow:  Panthers &gt; Red Wings  Blue Jackets &gt; Rangers  Capitals &gt; Coyotes  Hurricanes &gt; Trashhawks Golden Knights &gt; Ducks (Fuck both) Stars &gt; Senators   Season Record: 53-57,0.0
This is what coyotes do in our town lol 😂 https://t.co/4NLyQ9iXEp,0.0
Had a coyote come into the backyard with 3 people and 2 dogs out there! The dogs chased it and it went over the fence into the yard behind ours #coyotesighting #valinda #carefuleveryone,1.0
GIVE COLDWATER CANYON BACK TO THE COYOTES https://t.co/bEvU5WUMjT,0.0
"I also grabbed a pair of scissors that were in there for safety. When I was finally able to step out of the car and out of the sand I found the town had been destroyed and there was angry coyotes approaching me, some of them were feeding on the other bodies that didn’t make it",0.0
My parents are determined to let a coyote eat our 18 year old cat.,0.0
I JUST WATCHED A COUPLE LEAVE THEIR CRIB FOR A WALK AND GOT FOLLOWED BY 2 COYOTES LIKE RIGHT IN THEIR TRACKS LMFAOOOOL,1.0
The look… #wildlife #coyote #photography https://t.co/ly3op5n2d2,0.0
@rosiegirl1957 We live in “coyote central” and that’s a sound I have never gotten used to.,0.0
Coyotes roaming around rn 😂,1.0
@Southernvaper1 Eli is very big. His head is above my waist. And he turns heads wherever we go. Very friendly. But has killed a coyote with a single bite to the neck. Good companion.,1.0
Coyote revolution has begun btw,0.0
"@healthyheating I know this is a dumb reference, but I've loved watching my many dogs over the years putting their snouts up in the air to sample the drift. Off the breeze, coyote nearby? Or the waft of some dog in a car that just drove by. They're sniffing the tiny particles drifting by.",0.0
"Visiting dog (the coyote one) started barking at 4 A.M. so I got up and let him out long with the other dogs. They didn't go out &amp; start barking, thank goodness. But when I'm up, I'm up",0.0
@Doctor_Red_Fox There would be truly nothing worse then a coyote losing their blubbery frame!,0.0
"@HillaryMonahan Well, child, who decided to roll in the coyote shit? You did the crime. Now you have to do the punishment.",0.0
"@OctopusGilded Nice to see things like that out in the world. I live near a wildlife preserve, but all I ever see are coyotes. They don’t even have any decent Acme gear.",1.0
This sign messaging is excellent.  New coyote warning signs being erected in Richmond https://t.co/18PAen4nFU via @TheRichmondNews,0.0
"The city of Redlands designated as “terminated” Coyote Aviation’s 20-year lease five months early on a technicality. The Sept. 5, 2000, contract called for Coyote to express, in writing, its desire to extend its lease. Coyote submitted that request … https://t.co/HChOggYiFI",0.0
Coyote Experts Raising Awareness Following String Of Related Incidents https://t.co/5hvUwppXIJ  #easterncoyote #coexistence #foodconditioning #harmfulhandout #coyote,0.0
"@nhlleave @twolinepass When the Coyotes come to town it'll just say ""Big fat load of cum, then""",0.0
@ActiveNorCal best friends?? obviously that coyote is so whipped by that badger.. 😂,0.0
"@JBB_SD @spacey_coyote @10News @MayorToddGloria Jelena,   same for any other job.  If the boss says and asks you to do something and you say no....well....yea we know what happens",0.0
"@mikepompeo Wow, $450,000? I walked up #VanNuys Blvd. the other day &amp; saw just the opposite.  #ILLEGALimmigrants #enslaved while being #berated by those awful #coyotes.",0.0
"@CIAspygirl I highly recommend purchasing coyote urine. We have problems with them wanting to swim in our pool, but they spread really bad parasites, so we trapped a few but didn't feel great about it. Trying not to think about how the urine is collected to be sold...but it works!",0.0
Pee mail…! #wildlife #coyote #nature https://t.co/jjCz7xejFZ,0.0
"Hey Coyotes! Next week we do not have school on Thursday, November 11th. Please plan accordingly. https://t.co/10i9f7G6Lg",0.0
California Valley Coyote. Adolescent with parents nearby. #wildlife #coyote #photography https://t.co/2rYcAp11yI,0.0
"California edition: - coyote spotted, watch your pets -bear spotted, watch your kids -I smell smoke, is it a wildfire? - what is this wet stuff falling from the sky? https://t.co/OpNk9l6fuO",1.0
@johnlevenstein If we hadn’t defunded police there wouldn’t be so many coyotes!!!!!!!,0.0
